{
  "$schema": "http://json-schema.org/draft-07/schema#",
  "$comment": "GENERATED by gui/schema-gen/derive_nf_config_schemas.py from config/amf.json + its source (ADR-0425). Do not edit; regenerate.",
  "title": "amf",
  "type": "object",
  "additionalProperties": false,
  "properties": {
    "port": {
      "type": "integer",
      "x-cpp-type": "unsigned short"
    },
    "advertised_ipv4": {
      "type": "string",
      "x-env-override": "AMF_ADVERTISED_IPV4",
      "x-cpp-type": "std::string"
    },
    "sbi_bind_address": {
      "type": "string",
      "x-cpp-type": "std::string"
    },
    "metrics_bind_address": {
      "type": "string",
      "x-cpp-type": "std::string"
    },
    "nrf_base_url": {
      "type": "string",
      "x-env-override": "AMF_NRF_BASE_URL",
      "x-cpp-type": "std::string"
    },
    "ausf_base_url": {
      "type": "string",
      "x-env-override": "AMF_AUSF_BASE_URL",
      "x-cpp-type": "std::string"
    },
    "pcf_base_url": {
      "type": "string",
      "x-env-override": "AMF_PCF_BASE_URL",
      "x-cpp-type": "std::string"
    },
    "smf_base_url": {
      "type": "string",
      "x-env-override": "AMF_SMF_BASE_URL",
      "x-cpp-type": "std::string"
    },
    "nsacf_base_url": {
      "type": "string",
      "x-env-override": "AMF_NSACF_BASE_URL",
      "x-cpp-type": "std::string"
    },
    "smsf_base_url": {
      "type": "string",
      "x-env-override": "AMF_SMSF_BASE_URL",
      "x-cpp-type": "std::string"
    },
    "redis_url": {
      "type": "string",
      "x-env-override": "AMF_REDIS_URL",
      "x-cpp-type": "std::string"
    },
    "redis_mode": {
      "type": "string",
      "x-env-override": "AMF_REDIS_MODE",
      "x-cpp-type": "std::string"
    },
    "redis_pool_size": {
      "type": "integer",
      "x-env-override": "AMF_REDIS_POOL_SIZE",
      "x-cpp-type": "int"
    },
    "ngap_bind_address": {
      "type": "string",
      "x-cpp-type": "std::string"
    },
    "ngap_bind_port": {
      "type": "integer",
      "x-cpp-type": "std::uint16_t"
    },
    "amf_region_id": {
      "type": "integer",
      "x-cpp-type": "std::uint8_t"
    },
    "amf_set_id": {
      "type": "integer",
      "x-cpp-type": "std::uint16_t"
    },
    "amf_pointer": {
      "type": "integer",
      "x-cpp-type": "std::uint8_t"
    },
    "li_poi": {
      "type": "object",
      "additionalProperties": false,
      "properties": {
        "enabled": {
          "type": "boolean"
        },
        "x1_bind_address": {
          "type": "string"
        },
        "x1_port": {
          "type": "integer"
        },
        "ne_identifier": {
          "type": "string"
        },
        "network_function_id": {
          "type": "string"
        },
        "interception_point_id": {
          "type": "string"
        },
        "mdf2_host": {
          "type": "string"
        },
        "mdf2_port": {
          "type": "integer"
        },
        "mdf2_sni": {
          "type": "string"
        },
        "x1_keepalive_p1_seconds": {
          "type": "integer"
        },
        "x1_keepalive_p2_seconds": {
          "type": "integer"
        },
        "x1_keepalive_p3_seconds": {
          "type": "integer"
        },
        "x1_allow_deactivate_all": {
          "type": "boolean"
        }
      }
    },
    "nas_security": {
      "type": "object",
      "additionalProperties": false,
      "properties": {
        "alg_providers": {
          "type": "array"
        }
      }
    },
    "oauth2_required": {
      "type": "boolean",
      "x-env-override": "AMF_OAUTH2_REQUIRED",
      "x-cpp-type": "bool"
    }
  },
  "required": [
    "advertised_ipv4",
    "amf_pointer",
    "amf_region_id",
    "amf_set_id",
    "ausf_base_url",
    "metrics_bind_address",
    "ngap_bind_address",
    "ngap_bind_port",
    "nrf_base_url",
    "nsacf_base_url",
    "pcf_base_url",
    "port",
    "redis_url",
    "sbi_bind_address",
    "smf_base_url",
    "smsf_base_url"
  ],
  "x-config-file": "config/amf.json",
  "x-source": [
    "nfs/amf"
  ],
  "x-apply": "restart",
  "x-review": [
    "li_poi: nested object shape inferred from current values (map-vs-struct meaning unverified; new keys refused until reviewed)",
    "nas_security: nested object shape inferred from current values (map-vs-struct meaning unverified; new keys refused until reviewed)",
    "nas_security.alg_providers: empty array, item type unknown"
  ]
}
